{
	"$schema": "../printer-definition.schema.json",
	"name": "Mini",
	"description": "Mini bed slinger from Prusa Research",
	"manufacturer": "Prusa",
	"documentationLink": "https://os.ratrig.com/docs/printers/prusa-mini",
	"image": "prusa-mini.webp",
	"template": "prusa-mini-printer.template.cfg",
	"driverCountRequired": 4,
	"speedLimits": {
		"basic": {
			"accel": 3000,
			"velocity": 165,
			"z_accel": 200,
			"z_velocity": 15
		},
		"performance": {
			"accel": 15000,
			"velocity": 400,
			"z_accel": 600,
			"z_velocity": 15
		}
	},
	"defaults": {
		"board": "prusa-buddy",
		"controllerFan": "none",
		"toolheads": [
			{
				"axis": "x",
				"partFan": "4pin-dedicated",
				"hotendFan": "4pin-dedicated",
				"extruder": "prusa-mini",
				"hotend": "v6",
				"probe": "superpinda",
				"xEndstop": "endstop",
				"yEndstop": "endstop"
			}
		],
		"rails": [
			{
				"axis": "x",
				"axisDescription": "The X axis motor moves the print head left and right.",
				"current": 0.4,
				"performanceMode": {
					"current": 1.188
				},
				"rotationDistance": 32,
				"driver": "PRUSA-BUDDY-TMC2209",
				"stepper": "LDO-42STH40-1684AC"
			},
			{
				"axis": "y",
				"axisDescription": "The Y axis motor moves the print bed forward and backward.",
				"current": 0.4,
				"performanceMode": {
					"current": 1.188
				},
				"rotationDistance": 32,
				"driver": "PRUSA-BUDDY-TMC2209",
				"stepper": "LDO-42STH40-1684AC"
			},
			{
				"axis": "z",
				"axisDescription": "The Z axis motor moves the print head up and down.",
				"current": 0.4,
				"performanceMode": {
					"current": 1.188
				},
				"rotationDistance": 4,
				"driver": "PRUSA-BUDDY-TMC2209",
				"stepper": "LDO-42STH40-1684AC"
			},
			{
				"axis": "extruder",
				"axisDescription": "The extruder motor used for your toolhead",
				"current": 0.5,
				"driver": "PRUSA-BUDDY-TMC2209",
				"stepper": "generic",
				"rotationDistance": 0
			}
		]
	}
}
